{
  "seai_version": "1.0",
  "proposal_ref": "SEAI-P-001",
  "agent_id": "agent-001",
  "timestamp_utc": "2026-08-08T17:30:00Z",
  "hardware_provider": "TPM2.0",
  "attestation_quote": {
    "quote_data": "QkFTRTY0X0RBVEE=",
    "signature": "U0lHTkFUVVJFQkFTRTY0",
    "pcr_indices": [0, 1, 2, 3, 4, 5, 6, 7],
    "pcr_values": {
      "0": "a1b2c3d4e5f6a7b8c9d0e1f2a3b4c5d6e7f8a9b0c1d2e3f4a5b6c7d8e9f0a1b2",
      "1": "c3d4e5f6a7b8c9d0e1f2a3b4c5d6e7f8a9b0c1d2e3f4a5b6c7d8e9f0a1b2c3",
      "2": "e5f6a7b8c9d0e1f2a3b4c5d6e7f8a9b0c1d2e3f4a5b6c7d8e9f0a1b2c3d4e5",
      "3": "f6a7b8c9d0e1f2a3b4c5d6e7f8a9b0c1d2e3f4a5b6c7d8e9f0a1b2c3d4e5f6",
      "4": "a7b8c9d0e1f2a3b4c5d6e7f8a9b0c1d2e3f4a5b6c7d8e9f0a1b2c3d4e5f6a7",
      "5": "b8c9d0e1f2a3b4c5d6e7f8a9b0c1d2e3f4a5b6c7d8e9f0a1b2c3d4e5f6a7b8",
      "6": "c9d0e1f2a3b4c5d6e7f8a9b0c1d2e3f4a5b6c7d8e9f0a1b2c3d4e5f6a7b8c9",
      "7": "d0e1f2a3b4c5d6e7f8a9b0c1d2e3f4a5b6c7d8e9f0a1b2c3d4e5f6a7b8c9d0"
    }
  },
  "public_key": {
    "kty": "OKP",
    "crv": "Ed25519",
    "x": "TFdOdk1qSW5PVEExT1RJM056ZzM="
  }
}